<?xml version="1.0" encoding="UTF-8"?>
<personas xmlns:xsi="http://www.w3.org/2001/XMLSchema-instance" xsi:noNamespaceSchemaLocation="personas.xsd">
    <persona>
        <nombre>Juan Pardo</nombre>
        <nacimiento dia="10" mes="Abril" anyo="1982"></nacimiento>
        <direcciones>
            <direccion>
                <calle>caoba,1</calle>
                <poblacion>Madrid</poblacion>
                <provincia>Madrid</provincia>
                <cpostal>28055</cpostal>
            </direccion>
        </direcciones>
        <varon/>


    </persona>
    <persona>
        <nombre>Maria Lopez</nombre>
        <nacimiento dia="10" mes="Abril" anyo="1982"></nacimiento>
        <direcciones>
            <direccion>
                <calle>Roncato,1</calle>
                <poblacion>Illescas</poblacion>
                <provincia>toledo</provincia>
                <cpostal>42500</cpostal>
            </direccion>
            <direccion>
                <calle>Paseo de la esperanza, 5</calle>
                <poblacion>Madrid</poblacion>
                <provincia>Madrid</provincia>
                <cpostal>28005</cpostal>
            </direccion>
        </direcciones>
        <varon></varon>


    </persona>
</personas>